{
    "$schema": "https://json-schema.org/draft/2020-12/schema",
    "$id": "https://api.helioviewer.org/schema/post_screenshot.schema.json",
    "title": "Post Screenshot Parameters",
    "description": "Information used to generate a screenshot via helioviewer.org",
    "type": "object",
    "required": ["date", "imageScale", "layers"],
    "additionalProperties": false,
    "properties": {
        "date": {
            "type": "string",
            "pattern": "^\\d{4}-\\d{2}-\\d{2}T\\d{2}:\\d{2}:\\d{2}(\\.\\d{3})?Z$"
        },
        "imageScale": { "type": "number" },
        "layers": {
            "type": "string",
            "maxLength": 1000,
            "pattern": "^[\\_\\w\\]\\[,\\-:\\.\\+ ]+$"
        },
        "event_selections": {
            "$ref": "https://api.helioviewer.org/schema/event_selections.schema.json"
        },
        "event_visibility_selections": {
            "$ref": "https://api.helioviewer.org/schema/event_visibility_selections.schema.json"
        },
        "scale": { "type": "boolean" },
        "scaleType": {
            "type": "string",
            "enum": [
                "earth", "scalebar", "disabled"
            ]
        },
        "scaleX": { "type": "number" },
        "scaleY": { "type": "number" },
        "width": { "type": "number" },
        "height": { "type": "number" },
        "x0": { "type": "number" },
        "y0": { "type": "number" },
        "x1": { "type": "number" },
        "y1": { "type": "number" },
        "x2": { "type": "number" },
        "y2": { "type": "number" },
        "display": { "type": "boolean" },
        "watermark": { "type": "boolean" },
        "switchSources": { "type": "boolean" },
        "movieIcons": { "type": "boolean" },
        "celestialBodiesLabels": {
            "type": "string",
            "maxLength": 1000,
            "pattern": "^[a-zA-Z_\\-,]*$"
        },
        "celestialBodiesTrajectories": {
            "type": "string",
            "maxLength": 1000,
            "pattern": "^[a-zA-Z_\\-,]*$"
        },
        "callback": {
            "type": "string",
            "maxLength": 1000
        }
    }
}
