{
  "imageScale": 5.608481803348903,
  "layers": "[SDO,AIA,131,1,100,0,60,1,2018-03-30T04:18:36.000Z]",
  "scale": true,
  "scaleType": "earth",
  "scaleX": -2334,
  "scaleY": 2122,
  "movieIcons": false,
  "date": "2023-10-22T12:53:07.000Z",
  "display": false,
  "switchSources": false,
  "celestialBodiesLabels": "soho-mercury,soho-venus,soho-mars,soho-jupiter,soho-saturn,soho-uranus,soho-neptune,stereo_b-mercury,stereo_b-venus,stereo_b-earth,stereo_b-mars,stereo_b-jupiter,stereo_b-saturn,stereo_b-uranus,stereo_b-neptune",
  "celestialBodiesTrajectories": "",
  "x1": -3488.4756816830177,
  "x2": 3690.3810266035784,
  "y1": -2585.5101113438445,
  "y2": 4716.733196616427
}
